{
  "schema" : "santa-eval/v2",
  "op" : "Coll apply method equivalence",
  "blessed_by" : "jvm:sigma-state-6.0.3",
  "source" : "sigma-state:LanguageSpecificationV5",
  "entries" : [
    {
      "name" : "(Coll(1),0)#0",
      "script" : "{ (x: (Coll[Int], Int)) => x._1(x._2) }",
      "tree_bytes_hex" : "1a1700dad901014c10b28c7201018c7201020001e4e3014c10",
      "input" : {
        "kind" : "Tuple",
        "items" : [
          {
            "kind" : "Coll",
            "elem" : {
              "tag" : "SInt"
            },
            "items" : [
              {
                "kind" : "Int",
                "value" : 1
              }
            ]
          },
          {
            "kind" : "Int",
            "value" : 0
          }
        ]
      },
      "version" : {
        "activated" : 2,
        "ergoTree" : 2
      },
      "expected" : {
        "value" : {
          "kind" : "Int",
          "value" : 1
        },
        "cost" : 125,
        "error" : null
      }
    },
    {
      "name" : "(Coll(1,2),1)#1",
      "script" : "{ (x: (Coll[Int], Int)) => x._1(x._2) }",
      "tree_bytes_hex" : "1a1700dad901014c10b28c7201018c7201020001e4e3014c10",
      "input" : {
        "kind" : "Tuple",
        "items" : [
          {
            "kind" : "Coll",
            "elem" : {
              "tag" : "SInt"
            },
            "items" : [
              {
                "kind" : "Int",
                "value" : 1
              },
              {
                "kind" : "Int",
                "value" : 2
              }
            ]
          },
          {
            "kind" : "Int",
            "value" : 1
          }
        ]
      },
      "version" : {
        "activated" : 2,
        "ergoTree" : 2
      },
      "expected" : {
        "value" : {
          "kind" : "Int",
          "value" : 2
        },
        "cost" : 125,
        "error" : null
      }
    },
    {
      "name" : "(Coll(1,2),1)#2",
      "script" : "{ (x: (Coll[Int], Int)) => x._1(x._2) }",
      "tree_bytes_hex" : "1a1700dad901014c10b28c7201018c7201020001e4e3014c10",
      "input" : {
        "kind" : "Tuple",
        "items" : [
          {
            "kind" : "Coll",
            "elem" : {
              "tag" : "SInt"
            },
            "items" : [
              {
                "kind" : "Int",
                "value" : 1
              },
              {
                "kind" : "Int",
                "value" : 2
              }
            ]
          },
          {
            "kind" : "Int",
            "value" : 1
          }
        ]
      },
      "version" : {
        "activated" : 2,
        "ergoTree" : 2
      },
      "expected" : {
        "value" : {
          "kind" : "Int",
          "value" : 2
        },
        "cost" : 125,
        "error" : null
      }
    }
  ]
}