{
  "schema" : "santa-eval/v2",
  "op" : "Coll map method equivalence",
  "blessed_by" : "jvm:sigma-state-6.0.3",
  "source" : "sigma-state:LanguageSpecificationV5",
  "entries" : [
    {
      "name" : "Coll()#0",
      "script" : "{ (x: Coll[Int]) => x.map({ (v: Int) => v + 1 }) }",
      "tree_bytes_hex" : "1a19010402dad9010110ad7201d90103049a7203730001e4e30110",
      "input" : {
        "kind" : "Coll",
        "elem" : {
          "tag" : "SInt"
        },
        "items" : [
        ]
      },
      "version" : {
        "activated" : 2,
        "ergoTree" : 2
      },
      "expected" : {
        "value" : {
          "kind" : "Coll",
          "elem" : {
            "tag" : "SInt"
          },
          "items" : [
          ]
        },
        "cost" : 96,
        "error" : null
      }
    },
    {
      "name" : "Coll(1)#1",
      "script" : "{ (x: Coll[Int]) => x.map({ (v: Int) => v + 1 }) }",
      "tree_bytes_hex" : "1a19010402dad9010110ad7201d90103049a7203730001e4e30110",
      "input" : {
        "kind" : "Coll",
        "elem" : {
          "tag" : "SInt"
        },
        "items" : [
          {
            "kind" : "Int",
            "value" : 1
          }
        ]
      },
      "version" : {
        "activated" : 2,
        "ergoTree" : 2
      },
      "expected" : {
        "value" : {
          "kind" : "Coll",
          "elem" : {
            "tag" : "SInt"
          },
          "items" : [
            {
              "kind" : "Int",
              "value" : 2
            }
          ]
        },
        "cost" : 122,
        "error" : null
      }
    },
    {
      "name" : "Coll(1,2)#2",
      "script" : "{ (x: Coll[Int]) => x.map({ (v: Int) => v + 1 }) }",
      "tree_bytes_hex" : "1a19010402dad9010110ad7201d90103049a7203730001e4e30110",
      "input" : {
        "kind" : "Coll",
        "elem" : {
          "tag" : "SInt"
        },
        "items" : [
          {
            "kind" : "Int",
            "value" : 1
          },
          {
            "kind" : "Int",
            "value" : 2
          }
        ]
      },
      "version" : {
        "activated" : 2,
        "ergoTree" : 2
      },
      "expected" : {
        "value" : {
          "kind" : "Coll",
          "elem" : {
            "tag" : "SInt"
          },
          "items" : [
            {
              "kind" : "Int",
              "value" : 2
            },
            {
              "kind" : "Int",
              "value" : 3
            }
          ]
        },
        "cost" : 148,
        "error" : null
      }
    }
  ]
}