{
  "schema" : "santa-eval/v2",
  "op" : "Byte methods - 6.0 features",
  "blessed_by" : "jvm:sigma-state-6.0.3",
  "source" : "sigma-state:LanguageSpecificationV6",
  "entries" : [
    {
      "name" : "(1,2)#0",
      "script" : "{ (x: (Byte, Byte)) => x._1.bitwiseOr(x._2) }",
      "tree_bytes_hex" : "1b1700dad9010156dc02098c720101018c72010201e4e30156",
      "input" : {
        "kind" : "Tuple",
        "items" : [
          {
            "kind" : "Byte",
            "value" : 1
          },
          {
            "kind" : "Byte",
            "value" : 2
          }
        ]
      },
      "version" : {
        "activated" : 3,
        "ergoTree" : 3
      },
      "expected" : {
        "value" : {
          "kind" : "Byte",
          "value" : 3
        },
        "cost" : 104,
        "error" : null
      }
    },
    {
      "name" : "1#1",
      "script" : "{ (x: Byte) => x.bitwiseInverse }",
      "tree_bytes_hex" : "1b1000dad9010102db0208720101e4e30102",
      "input" : {
        "kind" : "Byte",
        "value" : 1
      },
      "version" : {
        "activated" : 3,
        "ergoTree" : 3
      },
      "expected" : {
        "value" : {
          "kind" : "Byte",
          "value" : -2
        },
        "cost" : 79,
        "error" : null
      }
    },
    {
      "name" : "(3,5)#2",
      "script" : "{ (x: (Byte, Byte)) => x._1.bitwiseAnd(x._2) }",
      "tree_bytes_hex" : "1b1700dad9010156dc020a8c720101018c72010201e4e30156",
      "input" : {
        "kind" : "Tuple",
        "items" : [
          {
            "kind" : "Byte",
            "value" : 3
          },
          {
            "kind" : "Byte",
            "value" : 5
          }
        ]
      },
      "version" : {
        "activated" : 3,
        "ergoTree" : 3
      },
      "expected" : {
        "value" : {
          "kind" : "Byte",
          "value" : 1
        },
        "cost" : 104,
        "error" : null
      }
    },
    {
      "name" : "(3,5)#3",
      "script" : "{ (x: (Byte, Byte)) => x._1.bitwiseXor(x._2) }",
      "tree_bytes_hex" : "1b1700dad9010156dc020b8c720101018c72010201e4e30156",
      "input" : {
        "kind" : "Tuple",
        "items" : [
          {
            "kind" : "Byte",
            "value" : 3
          },
          {
            "kind" : "Byte",
            "value" : 5
          }
        ]
      },
      "version" : {
        "activated" : 3,
        "ergoTree" : 3
      },
      "expected" : {
        "value" : {
          "kind" : "Byte",
          "value" : 6
        },
        "cost" : 104,
        "error" : null
      }
    },
    {
      "name" : "127#4",
      "script" : "{ (x: Byte) => x.toBytes }",
      "tree_bytes_hex" : "1b1000dad9010102db0206720101e4e30102",
      "input" : {
        "kind" : "Byte",
        "value" : 127
      },
      "version" : {
        "activated" : 3,
        "ergoTree" : 3
      },
      "expected" : {
        "value" : {
          "kind" : "Coll",
          "elem" : {
            "tag" : "SByte"
          },
          "items" : [
            {
              "kind" : "Byte",
              "value" : 127
            }
          ]
        },
        "cost" : 79,
        "error" : null
      }
    },
    {
      "name" : "83#5",
      "script" : "{ (x: Byte) => x.toBits }",
      "tree_bytes_hex" : "1b1000dad9010102db0207720101e4e30102",
      "input" : {
        "kind" : "Byte",
        "value" : 83
      },
      "version" : {
        "activated" : 3,
        "ergoTree" : 3
      },
      "expected" : {
        "value" : {
          "kind" : "Coll",
          "elem" : {
            "tag" : "SBoolean"
          },
          "items" : [
            {
              "kind" : "Boolean",
              "value" : false
            },
            {
              "kind" : "Boolean",
              "value" : true
            },
            {
              "kind" : "Boolean",
              "value" : false
            },
            {
              "kind" : "Boolean",
              "value" : true
            },
            {
              "kind" : "Boolean",
              "value" : false
            },
            {
              "kind" : "Boolean",
              "value" : false
            },
            {
              "kind" : "Boolean",
              "value" : true
            },
            {
              "kind" : "Boolean",
              "value" : true
            }
          ]
        },
        "cost" : 79,
        "error" : null
      }
    },
    {
      "name" : "-55#6",
      "script" : "{ (x: Byte) => x.toBits }",
      "tree_bytes_hex" : "1b1000dad9010102db0207720101e4e30102",
      "input" : {
        "kind" : "Byte",
        "value" : -55
      },
      "version" : {
        "activated" : 3,
        "ergoTree" : 3
      },
      "expected" : {
        "value" : {
          "kind" : "Coll",
          "elem" : {
            "tag" : "SBoolean"
          },
          "items" : [
            {
              "kind" : "Boolean",
              "value" : true
            },
            {
              "kind" : "Boolean",
              "value" : true
            },
            {
              "kind" : "Boolean",
              "value" : false
            },
            {
              "kind" : "Boolean",
              "value" : false
            },
            {
              "kind" : "Boolean",
              "value" : true
            },
            {
              "kind" : "Boolean",
              "value" : false
            },
            {
              "kind" : "Boolean",
              "value" : false
            },
            {
              "kind" : "Boolean",
              "value" : true
            }
          ]
        },
        "cost" : 79,
        "error" : null
      }
    },
    {
      "name" : "-1#7",
      "script" : "{ (x: Byte) => x.toBits }",
      "tree_bytes_hex" : "1b1000dad9010102db0207720101e4e30102",
      "input" : {
        "kind" : "Byte",
        "value" : -1
      },
      "version" : {
        "activated" : 3,
        "ergoTree" : 3
      },
      "expected" : {
        "value" : {
          "kind" : "Coll",
          "elem" : {
            "tag" : "SBoolean"
          },
          "items" : [
            {
              "kind" : "Boolean",
              "value" : true
            },
            {
              "kind" : "Boolean",
              "value" : true
            },
            {
              "kind" : "Boolean",
              "value" : true
            },
            {
              "kind" : "Boolean",
              "value" : true
            },
            {
              "kind" : "Boolean",
              "value" : true
            },
            {
              "kind" : "Boolean",
              "value" : true
            },
            {
              "kind" : "Boolean",
              "value" : true
            },
            {
              "kind" : "Boolean",
              "value" : true
            }
          ]
        },
        "cost" : 79,
        "error" : null
      }
    },
    {
      "name" : "(3,3)#8",
      "script" : "{ (x: (Byte, Int)) => x._1.shiftLeft(x._2) }",
      "tree_bytes_hex" : "1b1900dad901013e04dc020c8c720101018c72010201e4e3013e04",
      "input" : {
        "kind" : "Tuple",
        "items" : [
          {
            "kind" : "Byte",
            "value" : 3
          },
          {
            "kind" : "Int",
            "value" : 3
          }
        ]
      },
      "version" : {
        "activated" : 3,
        "ergoTree" : 3
      },
      "expected" : {
        "value" : {
          "kind" : "Byte",
          "value" : 24
        },
        "cost" : 104,
        "error" : null
      }
    },
    {
      "name" : "(3,0)#9",
      "script" : "{ (x: (Byte, Int)) => x._1.shiftLeft(x._2) }",
      "tree_bytes_hex" : "1b1900dad901013e04dc020c8c720101018c72010201e4e3013e04",
      "input" : {
        "kind" : "Tuple",
        "items" : [
          {
            "kind" : "Byte",
            "value" : 3
          },
          {
            "kind" : "Int",
            "value" : 0
          }
        ]
      },
      "version" : {
        "activated" : 3,
        "ergoTree" : 3
      },
      "expected" : {
        "value" : {
          "kind" : "Byte",
          "value" : 3
        },
        "cost" : 104,
        "error" : null
      }
    },
    {
      "name" : "(24,3)#10",
      "script" : "{ (x: (Byte, Int)) => x._1.shiftRight(x._2) }",
      "tree_bytes_hex" : "1b1900dad901013e04dc020d8c720101018c72010201e4e3013e04",
      "input" : {
        "kind" : "Tuple",
        "items" : [
          {
            "kind" : "Byte",
            "value" : 24
          },
          {
            "kind" : "Int",
            "value" : 3
          }
        ]
      },
      "version" : {
        "activated" : 3,
        "ergoTree" : 3
      },
      "expected" : {
        "value" : {
          "kind" : "Byte",
          "value" : 3
        },
        "cost" : 104,
        "error" : null
      }
    },
    {
      "name" : "(24,0)#11",
      "script" : "{ (x: (Byte, Int)) => x._1.shiftRight(x._2) }",
      "tree_bytes_hex" : "1b1900dad901013e04dc020d8c720101018c72010201e4e3013e04",
      "input" : {
        "kind" : "Tuple",
        "items" : [
          {
            "kind" : "Byte",
            "value" : 24
          },
          {
            "kind" : "Int",
            "value" : 0
          }
        ]
      },
      "version" : {
        "activated" : 3,
        "ergoTree" : 3
      },
      "expected" : {
        "value" : {
          "kind" : "Byte",
          "value" : 24
        },
        "cost" : 104,
        "error" : null
      }
    }
  ]
}