{
  "schema" : "santa-eval/v2",
  "op" : "STypeVar.name_utf8_leniency",
  "blessed_by" : "jvm:sigma-state-6.0.3",
  "source" : "santa:authored-stypevar-name-utf8",
  "entries" : [
    {
      "name" : "name-utf8-ff-accept#0",
      "script" : "{ val f[T] = {(x: T) => x}; 5 }  // STypeVar name = invalid-UTF-8 [ff] (single invalid byte): JVM TypeSerializer lossy-decodes (new String(_, UTF_8) never throws) -> name accepted as U+FFFD -> Int 5 (name erased at eval). sigma-rust/ergots strict-reject non-UTF-8 -> errored. The CHARSET fork, distinct from ask-23's length bound; byte-exactness of the U+FFFD canonical form is the wire round-trip, not this accept vector.",
      "tree_bytes_hex" : "1b1501040ad801d701016701ffd901026701ff72027300",
      "input" : {
        "kind" : "Int",
        "value" : 0
      },
      "version" : {
        "activated" : 3,
        "ergoTree" : 3
      },
      "expected" : {
        "value" : {
          "kind" : "Int",
          "value" : 5
        },
        "cost" : 13,
        "error" : null
      }
    },
    {
      "name" : "name-utf8-e282-accept#1",
      "script" : "{ val f[T] = {(x: T) => x}; 5 }  // STypeVar name = invalid-UTF-8 [e282] (truncated 3-byte sequence): JVM TypeSerializer lossy-decodes (new String(_, UTF_8) never throws) -> name accepted as U+FFFD -> Int 5 (name erased at eval). sigma-rust/ergots strict-reject non-UTF-8 -> errored. The CHARSET fork, distinct from ask-23's length bound; byte-exactness of the U+FFFD canonical form is the wire round-trip, not this accept vector.",
      "tree_bytes_hex" : "1b1701040ad801d701016702e282d901026702e28272027300",
      "input" : {
        "kind" : "Int",
        "value" : 0
      },
      "version" : {
        "activated" : 3,
        "ergoTree" : 3
      },
      "expected" : {
        "value" : {
          "kind" : "Int",
          "value" : 5
        },
        "cost" : 13,
        "error" : null
      }
    },
    {
      "name" : "name-utf8-c080-accept#2",
      "script" : "{ val f[T] = {(x: T) => x}; 5 }  // STypeVar name = invalid-UTF-8 [c080] (overlong NUL encoding): JVM TypeSerializer lossy-decodes (new String(_, UTF_8) never throws) -> name accepted as U+FFFD -> Int 5 (name erased at eval). sigma-rust/ergots strict-reject non-UTF-8 -> errored. The CHARSET fork, distinct from ask-23's length bound; byte-exactness of the U+FFFD canonical form is the wire round-trip, not this accept vector.",
      "tree_bytes_hex" : "1b1701040ad801d701016702c080d901026702c08072027300",
      "input" : {
        "kind" : "Int",
        "value" : 0
      },
      "version" : {
        "activated" : 3,
        "ergoTree" : 3
      },
      "expected" : {
        "value" : {
          "kind" : "Int",
          "value" : 5
        },
        "cost" : 13,
        "error" : null
      }
    },
    {
      "name" : "name-utf8-eda080-accept#3",
      "script" : "{ val f[T] = {(x: T) => x}; 5 }  // STypeVar name = invalid-UTF-8 [eda080] (UTF-16 surrogate (ill-formed in UTF-8)): JVM TypeSerializer lossy-decodes (new String(_, UTF_8) never throws) -> name accepted as U+FFFD -> Int 5 (name erased at eval). sigma-rust/ergots strict-reject non-UTF-8 -> errored. The CHARSET fork, distinct from ask-23's length bound; byte-exactness of the U+FFFD canonical form is the wire round-trip, not this accept vector.",
      "tree_bytes_hex" : "1b1901040ad801d701016703eda080d901026703eda08072027300",
      "input" : {
        "kind" : "Int",
        "value" : 0
      },
      "version" : {
        "activated" : 3,
        "ergoTree" : 3
      },
      "expected" : {
        "value" : {
          "kind" : "Int",
          "value" : 5
        },
        "cost" : 13,
        "error" : null
      }
    },
    {
      "name" : "name-utf8-61ff62-accept#4",
      "script" : "{ val f[T] = {(x: T) => x}; 5 }  // STypeVar name = invalid-UTF-8 [61ff62] (valid / invalid / valid): JVM TypeSerializer lossy-decodes (new String(_, UTF_8) never throws) -> name accepted as U+FFFD -> Int 5 (name erased at eval). sigma-rust/ergots strict-reject non-UTF-8 -> errored. The CHARSET fork, distinct from ask-23's length bound; byte-exactness of the U+FFFD canonical form is the wire round-trip, not this accept vector.",
      "tree_bytes_hex" : "1b1901040ad801d70101670361ff62d90102670361ff6272027300",
      "input" : {
        "kind" : "Int",
        "value" : 0
      },
      "version" : {
        "activated" : 3,
        "ergoTree" : 3
      },
      "expected" : {
        "value" : {
          "kind" : "Int",
          "value" : 5
        },
        "cost" : 13,
        "error" : null
      }
    }
  ]
}